datetime_iso,datetime_ph,latitude_(n),longitude_(e),depth_km,mag,location,distance_km,bearing,reference_location
2025-11-14T19:21:00.000Z,14 November 2025 - 07:21 PM,11.01,123.80,012,1.9,020km S 78° W of City Of Bogo (Cebu),020,S 78° W,City Of Bogo (Cebu)
2025-11-14T19:04:00.000Z,14 November 2025 - 07:04 PM,05.71,126.19,125,2.5,065km S 69° E of Jose Abad Santos (Davao Occidental),065,S 69° E,Jose Abad Santos (Davao Occidental)
2025-11-14T18:40:00.000Z,14 November 2025 - 06:40 PM,10.28,126.97,007,2.6,105km N 59° E of General Luna (Surigao Del Norte),105,N 59° E,General Luna (Surigao Del Norte)
2025-11-14T18:48:00.000Z,14 November 2025 - 06:48 PM,11.04,124.06,004,3.4,008km S 85° E of City Of Bogo (Cebu),008,S 85° E,City Of Bogo (Cebu)
2025-11-14T18:35:00.000Z,14 November 2025 - 06:35 PM,09.63,126.15,031,1.3,017km S 03° W of General Luna (Surigao Del Norte),017,S 03° W,General Luna (Surigao Del Norte)
2025-11-14T18:30:00.000Z,14 November 2025 - 06:30 PM,10.16,126.55,017,2.7,055km N 73° E of Burgos (Surigao Del Norte),055,N 73° E,Burgos (Surigao Del Norte)
