datetime_iso,datetime_ph,latitude_(n),longitude_(e),depth_km,mag,location,distance_km,bearing,reference_location
2026-03-22T21:24:00.000Z,22 March 2026 - 09:24 PM,09.95,125.88,047,1.7,014km N 48° W of Del Carmen (Surigao Del Norte),014,N 48° W,Del Carmen (Surigao Del Norte)
2026-03-22T20:58:00.000Z,22 March 2026 - 08:58 PM,07.39,126.79,024,2.1,026km N 74° E of Caraga (Davao Oriental),026,N 74° E,Caraga (Davao Oriental)
2026-03-22T20:42:00.000Z,22 March 2026 - 08:42 PM,18.11,120.81,062,2.3,004km S 15° W of Carasi (Ilocos Norte),004,S 15° W,Carasi (Ilocos Norte)
2026-03-22T20:41:00.000Z,22 March 2026 - 08:41 PM,10.29,126.01,028,2.0,030km N 07° W of Santa Monica (Surigao Del Norte),030,N 07° W,Santa Monica (Surigao Del Norte)
2026-03-22T20:30:00.000Z,22 March 2026 - 08:30 PM,09.52,126.52,010,4.3,049km S 54° E of General Luna (Surigao Del Norte),049,S 54° E,General Luna (Surigao Del Norte)
