datetime_iso,datetime_ph,latitude_(n),longitude_(e),depth_km,mag,location,distance_km,bearing,reference_location
2026-04-29T04:43:00.000Z,29 April 2026 - 04:43 AM,08.51,126.53,013,2.2,027km N 54° E of Hinatuan (Surigao Del Sur),027,N 54° E,Hinatuan (Surigao Del Sur)
2026-04-29T04:10:00.000Z,29 April 2026 - 04:10 AM,17.56,120.04,019,1.6,035km S 84° W of Santa Catalina (Ilocos Sur),035,S 84° W,Santa Catalina (Ilocos Sur)
2026-04-29T03:55:00.000Z,29 April 2026 - 03:55 AM,07.63,124.16,024,1.5,006km S 09° E of Marogong (Lanao Del Sur),006,S 09° E,Marogong (Lanao Del Sur)
2026-04-29T03:54:00.000Z,29 April 2026 - 03:54 AM,15.02,122.03,017,2.4,020km N 18° E of Burdeos (Quezon),020,N 18° E,Burdeos (Quezon)
2026-04-29T03:44:00.000Z,29 April 2026 - 03:44 AM,16.29,122.04,017,2.4,009km N 84° W of Casiguran (Aurora),009,N 84° W,Casiguran (Aurora)
