datetime_iso,datetime_ph,latitude_(n),longitude_(e),depth_km,mag,location,distance_km,bearing,reference_location
2026-07-18T23:43:00.000Z,18 July 2026 - 11:43 PM,04.74,124.75,005,2.2,105km S 45° W of Balut Island (Municipality Of Sarangani) (Davao Occidental),105,S 45° W,Balut Island (Municipality Of Sarangani) (Davao Occidental)
2026-07-18T23:40:00.000Z,18 July 2026 - 11:40 PM,14.78,122.90,025,2.3,034km N 09° W of Tinaga Island (Vinzons) (Camarines Norte),034,N 09° W,Tinaga Island (Vinzons) (Camarines Norte)
2026-07-18T23:20:00.000Z,18 July 2026 - 11:20 PM,15.01,122.49,007,1.7,038km N 27° E of Jomalig (Quezon),038,N 27° E,Jomalig (Quezon)
2026-07-18T23:11:00.000Z,18 July 2026 - 11:11 PM,12.78,123.05,003,3.2,025km S 59° W of Claveria (Masbate),025,S 59° W,Claveria (Masbate)
2026-07-18T22:50:00.000Z,18 July 2026 - 10:50 PM,09.22,126.39,015,2.1,023km S 74° E of Cortes (Surigao Del Sur),023,S 74° E,Cortes (Surigao Del Sur)
2026-07-18T22:50:00.000Z,18 July 2026 - 10:50 PM,06.10,125.71,096,1.7,010km S 12° E of Don Marcelino (Davao Occidental),010,S 12° E,Don Marcelino (Davao Occidental)
