datetime_iso,datetime_ph,latitude_(n),longitude_(e),depth_km,mag,location,distance_km,bearing,reference_location
2026-05-07T04:27:00.000Z,07 May 2026 - 04:27 AM,05.93,125.26,077,2.3,005km S 33° W of Malapatan (Sarangani),005,S 33° W,Malapatan (Sarangani)
2026-05-07T04:01:00.000Z,07 May 2026 - 04:01 AM,06.92,126.17,010,3.6,007km S 57° W of City Of Mati (Davao Oriental),007,S 57° W,City Of Mati (Davao Oriental)
2026-05-07T03:49:00.000Z,07 May 2026 - 03:49 AM,06.32,126.28,055,1.7,044km S 32° E of Governor Generoso (Davao Oriental),044,S 32° E,Governor Generoso (Davao Oriental)
2026-05-07T03:40:00.000Z,07 May 2026 - 03:40 AM,04.90,126.40,009,3.2,121km S 58° E of Sarangani Island (Municipality Of Sarangani) (Davao Occidental),121,S 58° E,Sarangani Island (Municipality Of Sarangani) (Davao Occidental)
2026-05-07T03:38:00.000Z,07 May 2026 - 03:38 AM,18.67,121.05,033,1.4,008km N 27° W of Claveria (Cagayan),008,N 27° W,Claveria (Cagayan)
