datetime_iso,datetime_ph,latitude_(n),longitude_(e),depth_km,mag,location,distance_km,bearing,reference_location
2026-04-08T03:43:00.000Z,08 April 2026 - 03:43 AM,19.13,121.76,087,2.0,027km N 25° W of Camiguin Island (Calayan) (Cagayan),027,N 25° W,Camiguin Island (Calayan) (Cagayan)
2026-04-08T03:21:00.000Z,08 April 2026 - 03:21 AM,06.66,126.12,019,1.8,005km N 78° E of Governor Generoso (Davao Oriental),005,N 78° E,Governor Generoso (Davao Oriental)
2026-04-08T03:20:00.000Z,08 April 2026 - 03:20 AM,07.37,126.67,016,3.3,012km N 71° E of Caraga (Davao Oriental),012,N 71° E,Caraga (Davao Oriental)
2026-04-08T03:17:00.000Z,08 April 2026 - 03:17 AM,09.58,126.12,028,1.6,018km S 75° E of Socorro (Surigao Del Norte),018,S 75° E,Socorro (Surigao Del Norte)
2026-04-08T02:47:00.000Z,08 April 2026 - 02:47 AM,18.50,120.42,001,3.0,024km S 88° W of Burgos (Ilocos Norte),024,S 88° W,Burgos (Ilocos Norte)
