datetime_iso,datetime_ph,latitude_(n),longitude_(e),depth_km,mag,location,distance_km,bearing,reference_location
2025-12-15T14:50:00.000Z,15 December 2025 - 02:50 PM,06.15,127.65,030,3.7,170km S 46° E of Manay (Davao Oriental),170,S 46° E,Manay (Davao Oriental)
2025-12-15T14:05:00.000Z,15 December 2025 - 02:05 PM,09.13,126.67,014,2.3,046km N 67° E of Bayabas (Surigao Del Sur),046,N 67° E,Bayabas (Surigao Del Sur)
2025-12-15T14:05:00.000Z,15 December 2025 - 02:05 PM,09.13,126.67,014,2.3,046km N 67° E of Bayabas (Surigao Del Sur),046,N 67° E,Bayabas (Surigao Del Sur)
2025-12-15T14:03:00.000Z,15 December 2025 - 02:03 PM,18.07,121.25,019,1.6,009km N 53° E of Kabugao (Apayao),009,N 53° E,Kabugao (Apayao)
2025-12-15T14:02:00.000Z,15 December 2025 - 02:02 PM,08.96,126.11,022,2.7,008km N 82° E of San Miguel (Surigao Del Sur),008,N 82° E,San Miguel (Surigao Del Sur)
