datetime_iso,datetime_ph,latitude_(n),longitude_(e),depth_km,mag,location,distance_km,bearing,reference_location
2025-11-14T02:06:00.000Z,14 November 2025 - 02:06 AM,08.81,126.51,029,1.8,023km N 86° E of Marihatag (Surigao Del Sur),023,N 86° E,Marihatag (Surigao Del Sur)
2025-11-14T02:02:00.000Z,14 November 2025 - 02:02 AM,06.75,125.16,022,1.8,000km S 27° E of Magsaysay (Davao Del Sur),000,S 27° E,Magsaysay (Davao Del Sur)
2025-11-14T01:58:00.000Z,14 November 2025 - 01:58 AM,11.04,124.06,002,2.8,009km S 87° E of City Of Bogo (Cebu),009,S 87° E,City Of Bogo (Cebu)
2025-11-14T01:44:00.000Z,14 November 2025 - 01:44 AM,16.49,120.32,009,2.6,005km S 13° W of Bauang (La Union),005,S 13° W,Bauang (La Union)
2025-11-14T01:42:00.000Z,14 November 2025 - 01:42 AM,11.06,124.08,005,2.2,011km N 81° E of City Of Bogo (Cebu),011,N 81° E,City Of Bogo (Cebu)
2025-11-14T01:42:00.000Z,14 November 2025 - 01:42 AM,13.67,120.53,036,2.3,021km S 31° W of Calatagan (Batangas),021,S 31° W,Calatagan (Batangas)
2025-11-14T01:30:00.000Z,14 November 2025 - 01:30 AM,11.01,124.04,003,2.2,008km S 57° E of City Of Bogo (Cebu),008,S 57° E,City Of Bogo (Cebu)
2025-11-14T01:11:00.000Z,14 November 2025 - 01:11 AM,07.86,126.00,007,2.4,007km N 60° W of Monkayo (Davao De Oro),007,N 60° W,Monkayo (Davao De Oro)
