datetime_iso,datetime_ph,latitude_(n),longitude_(e),depth_km,mag,location,distance_km,bearing,reference_location
2025-11-22T21:05:00.000Z,22 November 2025 - 09:05 PM,09.52,126.10,004,2.3,030km S 13° W of General Luna (Surigao Del Norte),030,S 13° W,General Luna (Surigao Del Norte)
2025-11-22T20:51:00.000Z,22 November 2025 - 08:51 PM,10.33,126.14,033,2.0,035km N 13° E of Burgos (Surigao Del Norte),035,N 13° E,Burgos (Surigao Del Norte)
2025-11-22T20:41:00.000Z,22 November 2025 - 08:41 PM,13.24,120.79,032,1.9,019km N 23° E of Santa Cruz (Occidental Mindoro),019,N 23° E,Santa Cruz (Occidental Mindoro)
2025-11-22T20:38:00.000Z,22 November 2025 - 08:38 PM,05.69,126.60,029,2.8,108km S 77° E of Jose Abad Santos (Davao Occidental),108,S 77° E,Jose Abad Santos (Davao Occidental)
2025-11-22T20:34:00.000Z,22 November 2025 - 08:34 PM,07.21,126.95,009,2.7,045km S 89° E of Manay (Davao Oriental),045,S 89° E,Manay (Davao Oriental)
