datetime_iso,datetime_ph,latitude_(n),longitude_(e),depth_km,mag,location,distance_km,bearing,reference_location
2026-07-22T14:48:00.000Z,22 July 2026 - 02:48 PM,05.81,125.30,001,1.5,011km S 81° E of Glan (Sarangani),011,S 81° E,Glan (Sarangani)
2026-07-22T14:33:00.000Z,22 July 2026 - 02:33 PM,05.27,125.17,024,1.8,031km S 61° W of Balut Island (Municipality Of Sarangani) (Davao Occidental),031,S 61° W,Balut Island (Municipality Of Sarangani) (Davao Occidental)
2026-07-22T14:21:00.000Z,22 July 2026 - 02:21 PM,06.24,127.36,065,2.0,134km S 48° E of Tarragona (Davao Oriental),134,S 48° E,Tarragona (Davao Oriental)
2026-07-22T14:20:00.000Z,22 July 2026 - 02:20 PM,15.59,121.08,006,1.4,004km N 28° W of City Of Palayan (Nueva Ecija),004,N 28° W,City Of Palayan (Nueva Ecija)
2026-07-22T14:10:00.000Z,22 July 2026 - 02:10 PM,03.53,126.24,002,2.7,227km S 24° E of Balut Island (Municipality Of Sarangani) (Davao Occidental),227,S 24° E,Balut Island (Municipality Of Sarangani) (Davao Occidental)
