datetime_iso,datetime_ph,latitude_(n),longitude_(e),depth_km,mag,location,distance_km,bearing,reference_location
2026-04-13T03:18:00.000Z,13 April 2026 - 03:18 AM,07.31,127.07,021,2.1,056km S 88° E of Caraga (Davao Oriental),056,S 88° E,Caraga (Davao Oriental)
2026-04-13T03:11:00.000Z,13 April 2026 - 03:11 AM,06.93,125.87,026,2.0,024km S 47° E of Island Garden City Of Samal (Davao Del Norte),024,S 47° E,Island Garden City Of Samal (Davao Del Norte)
2026-04-13T03:02:00.000Z,13 April 2026 - 03:02 AM,10.99,123.97,003,2.0,006km S 42° W of City Of Bogo (Cebu),006,S 42° W,City Of Bogo (Cebu)
2026-04-13T02:41:00.000Z,13 April 2026 - 02:41 AM,09.63,126.23,020,1.7,018km S 25° E of General Luna (Surigao Del Norte),018,S 25° E,General Luna (Surigao Del Norte)
2026-04-13T02:34:00.000Z,13 April 2026 - 02:34 AM,20.46,121.23,032,3.1,068km N 79° W of Sabtang (Batanes),068,N 79° W,Sabtang (Batanes)
