datetime_iso,datetime_ph,latitude_(n),longitude_(e),depth_km,mag,location,distance_km,bearing,reference_location
2026-05-23T05:23:00.000Z,23 May 2026 - 05:23 AM,18.68,120.81,002,2.7,014km N 11° E of Pagudpud (Ilocos Norte),014,N 11° E,Pagudpud (Ilocos Norte)
2026-05-23T05:17:00.000Z,23 May 2026 - 05:17 AM,10.92,123.93,002,2.9,015km S 23° W of City Of Bogo (Cebu),015,S 23° W,City Of Bogo (Cebu)
2026-05-23T05:14:00.000Z,23 May 2026 - 05:14 AM,16.35,118.87,032,2.8,103km N 75° W of Agno (Pangasinan),103,N 75° W,Agno (Pangasinan)
2026-05-23T04:48:00.000Z,23 May 2026 - 04:48 AM,07.70,123.76,019,2.0,012km S 24° E of Sultan Naga Dimaporo (Lanao Del Norte),012,S 24° E,Sultan Naga Dimaporo (Lanao Del Norte)
2026-05-23T04:33:00.000Z,23 May 2026 - 04:33 AM,08.56,127.16,030,1.9,093km N 77° E of Hinatuan (Surigao Del Sur),093,N 77° E,Hinatuan (Surigao Del Sur)
2026-05-23T04:26:00.000Z,23 May 2026 - 04:26 AM,19.85,120.31,022,3.4,125km N 49° W of Dalupiri Island (Calayan) (Cagayan),125,N 49° W,Dalupiri Island (Calayan) (Cagayan)
2026-05-23T04:25:00.000Z,23 May 2026 - 04:25 AM,19.43,121.97,015,1.4,011km S 32° E of Babuyan Island (Calayan) (Cagayan),011,S 32° E,Babuyan Island (Calayan) (Cagayan)
