datetime_iso,datetime_ph,latitude_(n),longitude_(e),depth_km,mag,location,distance_km,bearing,reference_location
2025-10-16T19:02:00.000Z,16 October 2025 - 07:02 PM,13.07,120.69,010,3.9,003km S 65° W of Santa Cruz (Occidental Mindoro),003,S 65° W,Santa Cruz (Occidental Mindoro)
2025-10-16T18:27:00.000Z,16 October 2025 - 06:27 PM,07.36,127.76,033,3.1,135km N 83° E of Manay (Davao Oriental),135,N 83° E,Manay (Davao Oriental)
2025-10-16T18:17:00.000Z,16 October 2025 - 06:17 PM,11.28,124.06,030,1.3,027km N 18° E of City Of Bogo (Cebu),027,N 18° E,City Of Bogo (Cebu)
2025-10-16T18:04:00.000Z,16 October 2025 - 06:04 PM,07.34,126.74,015,2.9,026km N 56° E of Manay (Davao Oriental),026,N 56° E,Manay (Davao Oriental)
2025-10-16T18:03:00.000Z,16 October 2025 - 06:03 PM,11.03,124.09,002,2.7,013km S 83° E of City Of Bogo (Cebu),013,S 83° E,City Of Bogo (Cebu)
