datetime_iso,datetime_ph,latitude_(n),longitude_(e),depth_km,mag,location,distance_km,bearing,reference_location
2025-10-27T11:45:00.000Z,27 October 2025 - 11:45 AM,11.28,124.02,003,2.7,026km N 11° E of City Of Bogo (Cebu),026,N 11° E,City Of Bogo (Cebu)
2025-10-27T11:31:00.000Z,27 October 2025 - 11:31 AM,05.40,127.34,033,2.8,196km S 73° E of Jose Abad Santos (Davao Occidental),196,S 73° E,Jose Abad Santos (Davao Occidental)
2025-10-27T11:21:00.000Z,27 October 2025 - 11:21 AM,11.66,124.07,028,1.9,009km S 22° E of Esperanza (Masbate),009,S 22° E,Esperanza (Masbate)
2025-10-27T11:20:00.000Z,27 October 2025 - 11:20 AM,11.05,124.27,030,2.0,012km N 87° W of Palompon (Leyte),012,N 87° W,Palompon (Leyte)
2025-10-27T11:14:00.000Z,27 October 2025 - 11:14 AM,09.62,126.19,032,2.0,019km S 11° E of General Luna (Surigao Del Norte),019,S 11° E,General Luna (Surigao Del Norte)
2025-10-27T10:57:00.000Z,27 October 2025 - 10:57 AM,08.77,126.61,025,3.3,038km S 65° E of Cagwait (Surigao Del Sur),038,S 65° E,Cagwait (Surigao Del Sur)
