datetime_iso,datetime_ph,latitude_(n),longitude_(e),depth_km,mag,location,distance_km,bearing,reference_location
2025-10-27T18:59:00.000Z,27 October 2025 - 06:59 PM,09.67,126.17,032,1.8,013km S 07° E of General Luna (Surigao Del Norte),013,S 07° E,General Luna (Surigao Del Norte)
2025-10-27T18:46:00.000Z,27 October 2025 - 06:46 PM,16.20,120.84,018,2.5,017km N 29° E of San Nicolas (Pangasinan),017,N 29° E,San Nicolas (Pangasinan)
2025-10-27T18:35:00.000Z,27 October 2025 - 06:35 PM,09.74,126.33,033,1.8,020km S 75° E of General Luna (Surigao Del Norte),020,S 75° E,General Luna (Surigao Del Norte)
2025-10-27T18:25:00.000Z,27 October 2025 - 06:25 PM,13.99,122.91,001,2.0,007km S 40° E of San Lorenzo Ruiz (Camarines Norte),007,S 40° E,San Lorenzo Ruiz (Camarines Norte)
2025-10-27T18:07:00.000Z,27 October 2025 - 06:07 PM,13.35,121.71,018,1.8,018km S 52° W of Boac (Marinduque),018,S 52° W,Boac (Marinduque)
