datetime_iso,datetime_ph,latitude_(n),longitude_(e),depth_km,mag,location,distance_km,bearing,reference_location
2026-03-22T20:42:00.000Z,22 March 2026 - 08:42 PM,18.11,120.81,062,2.3,004km S 15° W of Carasi (Ilocos Norte),004,S 15° W,Carasi (Ilocos Norte)
2026-03-22T20:41:00.000Z,22 March 2026 - 08:41 PM,10.29,126.01,028,2.0,030km N 07° W of Santa Monica (Surigao Del Norte),030,N 07° W,Santa Monica (Surigao Del Norte)
2026-03-22T20:30:00.000Z,22 March 2026 - 08:30 PM,09.52,126.52,010,4.3,049km S 54° E of General Luna (Surigao Del Norte),049,S 54° E,General Luna (Surigao Del Norte)
2026-03-22T20:10:00.000Z,22 March 2026 - 08:10 PM,13.38,120.52,035,3.4,007km S 58° E of Paluan (Occidental Mindoro),007,S 58° E,Paluan (Occidental Mindoro)
2026-03-22T20:08:00.000Z,22 March 2026 - 08:08 PM,06.47,126.56,078,2.5,058km S 70° E of Governor Generoso (Davao Oriental),058,S 70° E,Governor Generoso (Davao Oriental)
