datetime_iso,datetime_ph,latitude_(n),longitude_(e),depth_km,mag,location,distance_km,bearing,reference_location
2026-06-28T00:22:00.000Z,28 June 2026 - 12:22 AM,05.76,125.34,019,2.4,017km S 65° E of Glan (Sarangani),017,S 65° E,Glan (Sarangani)
2026-06-28T00:16:00.000Z,28 June 2026 - 12:16 AM,09.65,126.24,025,2.8,017km S 33° E of General Luna (Surigao Del Norte),017,S 33° E,General Luna (Surigao Del Norte)
2026-06-27T23:49:00.000Z,27 June 2026 - 11:49 PM,09.07,126.43,035,2.7,019km N 56° E of Bayabas (Surigao Del Sur),019,N 56° E,Bayabas (Surigao Del Sur)
2026-06-27T23:31:00.000Z,27 June 2026 - 11:31 PM,05.66,125.30,024,1.5,021km S 32° E of Glan (Sarangani),021,S 32° E,Glan (Sarangani)
2026-06-27T23:30:00.000Z,27 June 2026 - 11:30 PM,05.39,126.38,044,1.8,101km S 84° E of Sarangani Island (Municipality Of Sarangani) (Davao Occidental),101,S 84° E,Sarangani Island (Municipality Of Sarangani) (Davao Occidental)
2026-06-27T23:26:00.000Z,27 June 2026 - 11:26 PM,05.31,125.12,029,2.2,035km S 72° W of Balut Island (Municipality Of Sarangani) (Davao Occidental),035,S 72° W,Balut Island (Municipality Of Sarangani) (Davao Occidental)
