datetime_iso,datetime_ph,latitude_(n),longitude_(e),depth_km,mag,location,distance_km,bearing,reference_location
2025-10-26T16:09:00.000Z,26 October 2025 - 04:09 PM,09.59,126.23,032,1.5,023km S 20° E of General Luna (Surigao Del Norte),023,S 20° E,General Luna (Surigao Del Norte)
2025-10-26T15:55:00.000Z,26 October 2025 - 03:55 PM,10.41,126.31,003,2.5,050km N 31° E of Burgos (Surigao Del Norte),050,N 31° E,Burgos (Surigao Del Norte)
2025-10-26T15:41:00.000Z,26 October 2025 - 03:41 PM,07.35,126.86,015,2.9,038km N 66° E of Manay (Davao Oriental),038,N 66° E,Manay (Davao Oriental)
2025-10-26T15:37:00.000Z,26 October 2025 - 03:37 PM,13.04,121.31,007,1.5,010km S 79° W of Socorro (Oriental Mindoro),010,S 79° W,Socorro (Oriental Mindoro)
2025-10-26T15:14:00.000Z,26 October 2025 - 03:14 PM,13.55,121.11,028,1.9,004km N 64° E of Verde Island (Batangas City) (Batangas),004,N 64° E,Verde Island (Batangas City) (Batangas)
