datetime_iso,datetime_ph,latitude_(n),longitude_(e),depth_km,mag,location,distance_km,bearing,reference_location
2026-06-20T12:35:00.000Z,20 June 2026 - 12:35 PM,06.75,126.78,108,3.9,049km S 48° E of Tarragona (Davao Oriental),049,S 48° E,Tarragona (Davao Oriental)
2026-06-20T12:32:00.000Z,20 June 2026 - 12:32 PM,13.31,120.78,032,1.7,016km S 20° E of Abra De Ilog (Occidental Mindoro),016,S 20° E,Abra De Ilog (Occidental Mindoro)
2026-06-20T12:22:00.000Z,20 June 2026 - 12:22 PM,06.19,126.70,028,2.4,086km S 54° E of Governor Generoso (Davao Oriental),086,S 54° E,Governor Generoso (Davao Oriental)
2026-06-20T12:16:00.000Z,20 June 2026 - 12:16 PM,05.21,125.03,008,2.8,049km S 62° W of Balut Island (Municipality Of Sarangani) (Davao Occidental),049,S 62° W,Balut Island (Municipality Of Sarangani) (Davao Occidental)
2026-06-20T12:14:00.000Z,20 June 2026 - 12:14 PM,05.59,125.26,023,1.7,027km N 44° W of Balut Island (Municipality Of Sarangani) (Davao Occidental),027,N 44° W,Balut Island (Municipality Of Sarangani) (Davao Occidental)
2026-06-20T11:55:00.000Z,20 June 2026 - 11:55 AM,10.90,123.91,002,2.4,018km S 27° W of City Of Bogo (Cebu),018,S 27° W,City Of Bogo (Cebu)
2026-06-20T11:46:00.000Z,20 June 2026 - 11:46 AM,05.27,125.16,012,2.0,034km S 61° W of Balut Island (Municipality Of Sarangani) (Davao Occidental),034,S 61° W,Balut Island (Municipality Of Sarangani) (Davao Occidental)
2026-06-20T11:41:00.000Z,20 June 2026 - 11:41 AM,08.12,126.51,027,2.3,014km N 50° E of Lingig (Surigao Del Sur),014,N 50° E,Lingig (Surigao Del Sur)
2026-06-20T11:39:00.000Z,20 June 2026 - 11:39 AM,06.44,126.48,046,2.4,050km S 63° E of Governor Generoso (Davao Oriental),050,S 63° E,Governor Generoso (Davao Oriental)
