datetime_iso,datetime_ph,latitude_(n),longitude_(e),depth_km,mag,location,distance_km,bearing,reference_location
2025-11-15T22:02:00.000Z,15 November 2025 - 10:02 PM,18.08,120.78,016,1.8,002km S 52° E of Solsona (Ilocos Norte),002,S 52° E,Solsona (Ilocos Norte)
2025-11-15T22:01:00.000Z,15 November 2025 - 10:01 PM,19.09,122.03,031,2.2,026km N 41° E of Camiguin Island (Calayan) (Cagayan),026,N 41° E,Camiguin Island (Calayan) (Cagayan)
2025-11-15T21:50:00.000Z,15 November 2025 - 09:50 PM,11.11,123.92,007,3.1,010km N 41° W of City Of Bogo (Cebu),010,N 41° W,City Of Bogo (Cebu)
2025-11-15T21:35:00.000Z,15 November 2025 - 09:35 PM,08.80,126.43,019,2.1,019km S 46° E of Cagwait (Surigao Del Sur),019,S 46° E,Cagwait (Surigao Del Sur)
2025-11-15T21:35:00.000Z,15 November 2025 - 09:35 PM,13.13,120.79,033,1.3,010km N 56° E of Santa Cruz (Occidental Mindoro),010,N 56° E,Santa Cruz (Occidental Mindoro)
2025-11-15T21:17:00.000Z,15 November 2025 - 09:17 PM,09.91,126.42,009,2.3,033km N 64° E of General Luna (Surigao Del Norte),033,N 64° E,General Luna (Surigao Del Norte)
2025-11-15T21:17:00.000Z,15 November 2025 - 09:17 PM,09.91,126.42,009,2.3,033km N 64° E of General Luna (Surigao Del Norte),033,N 64° E,General Luna (Surigao Del Norte)
2025-11-15T21:11:00.000Z,15 November 2025 - 09:11 PM,13.37,120.47,032,1.4,005km S 08° E of Paluan (Occidental Mindoro),005,S 08° E,Paluan (Occidental Mindoro)
