datetime_iso,datetime_ph,latitude_(n),longitude_(e),depth_km,mag,location,distance_km,bearing,reference_location
2026-02-23T19:25:00.000Z,23 February 2026 - 07:25 PM,13.74,120.00,001,2.7,019km S 45° W of Lubang (Occidental Mindoro),019,S 45° W,Lubang (Occidental Mindoro)
2026-02-23T19:19:00.000Z,23 February 2026 - 07:19 PM,13.82,120.54,080,1.8,010km S 85° W of Calatagan (Batangas),010,S 85° W,Calatagan (Batangas)
2026-02-23T19:12:00.000Z,23 February 2026 - 07:12 PM,08.79,126.41,011,2.5,019km S 38° E of Cagwait (Surigao Del Sur),019,S 38° E,Cagwait (Surigao Del Sur)
2026-02-23T19:10:00.000Z,23 February 2026 - 07:10 PM,08.78,126.47,011,2.4,024km S 50° E of Cagwait (Surigao Del Sur),024,S 50° E,Cagwait (Surigao Del Sur)
2026-02-23T18:26:00.000Z,23 February 2026 - 06:26 PM,09.65,126.14,025,2.0,015km S 06° W of General Luna (Surigao Del Norte),015,S 06° W,General Luna (Surigao Del Norte)
