datetime_iso,datetime_ph,latitude_(n),longitude_(e),depth_km,mag,location,distance_km,bearing,reference_location
2026-05-06T05:26:00.000Z,06 May 2026 - 05:26 AM,08.78,126.61,015,1.6,035km S 87° E of Marihatag (Surigao Del Sur),035,S 87° E,Marihatag (Surigao Del Sur)
2026-05-06T05:14:00.000Z,06 May 2026 - 05:14 AM,19.20,121.20,015,2.5,011km N 05° W of Dalupiri Island (Calayan) (Cagayan),011,N 05° W,Dalupiri Island (Calayan) (Cagayan)
2026-05-06T05:05:00.000Z,06 May 2026 - 05:05 AM,16.12,121.99,020,1.5,004km S 62° E of Dinalungan (Aurora),004,S 62° E,Dinalungan (Aurora)
2026-05-06T04:57:00.000Z,06 May 2026 - 04:57 AM,08.89,126.18,023,1.9,014km S 53° W of Bayabas (Surigao Del Sur),014,S 53° W,Bayabas (Surigao Del Sur)
2026-05-06T04:27:00.000Z,06 May 2026 - 04:27 AM,02.58,128.04,232,4.1,428km S 43° E of Balut Island (Municipality Of Sarangani) (Davao Occidental),428,S 43° E,Balut Island (Municipality Of Sarangani) (Davao Occidental)
2026-05-06T04:28:00.000Z,06 May 2026 - 04:28 AM,18.24,120.71,038,1.4,006km N 76° E of Vintar (Ilocos Norte),006,N 76° E,Vintar (Ilocos Norte)
