datetime_iso,datetime_ph,latitude_(n),longitude_(e),depth_km,mag,location,distance_km,bearing,reference_location
2025-11-14T02:55:00.000Z,14 November 2025 - 02:55 AM,10.24,126.42,010,2.3,045km N 57° E of Burgos (Surigao Del Norte),045,N 57° E,Burgos (Surigao Del Norte)
2025-11-14T02:46:00.000Z,14 November 2025 - 02:46 AM,07.18,126.92,012,2.6,043km S 68° E of Caraga (Davao Oriental),043,S 68° E,Caraga (Davao Oriental)
2025-11-14T02:40:00.000Z,14 November 2025 - 02:40 AM,09.38,125.83,082,1.7,013km N 83° W of Carrascal (Surigao Del Sur),013,N 83° W,Carrascal (Surigao Del Sur)
2025-11-14T02:37:00.000Z,14 November 2025 - 02:37 AM,19.00,121.20,013,2.9,012km S 06° W of Dalupiri Island (Calayan) (Cagayan),012,S 06° W,Dalupiri Island (Calayan) (Cagayan)
2025-11-14T02:34:00.000Z,14 November 2025 - 02:34 AM,10.54,125.03,002,2.4,014km N 86° W of Silago (Southern Leyte),014,N 86° W,Silago (Southern Leyte)
2025-11-14T02:14:00.000Z,14 November 2025 - 02:14 AM,10.99,123.95,004,2.5,007km S 25° W of City Of Bogo (Cebu),007,S 25° W,City Of Bogo (Cebu)
2025-11-14T02:06:00.000Z,14 November 2025 - 02:06 AM,08.81,126.51,029,1.8,023km N 86° E of Marihatag (Surigao Del Sur),023,N 86° E,Marihatag (Surigao Del Sur)
2025-11-14T02:02:00.000Z,14 November 2025 - 02:02 AM,06.75,125.16,022,1.8,000km S 27° E of Magsaysay (Davao Del Sur),000,S 27° E,Magsaysay (Davao Del Sur)
2025-11-14T01:58:00.000Z,14 November 2025 - 01:58 AM,11.04,124.06,002,2.8,009km S 87° E of City Of Bogo (Cebu),009,S 87° E,City Of Bogo (Cebu)
2025-11-14T01:44:00.000Z,14 November 2025 - 01:44 AM,16.49,120.32,009,2.6,005km S 13° W of Bauang (La Union),005,S 13° W,Bauang (La Union)
2025-11-14T01:42:00.000Z,14 November 2025 - 01:42 AM,11.06,124.08,005,2.2,011km N 81° E of City Of Bogo (Cebu),011,N 81° E,City Of Bogo (Cebu)
2025-11-14T01:42:00.000Z,14 November 2025 - 01:42 AM,13.67,120.53,036,2.3,021km S 31° W of Calatagan (Batangas),021,S 31° W,Calatagan (Batangas)
2025-11-14T01:30:00.000Z,14 November 2025 - 01:30 AM,11.01,124.04,003,2.2,008km S 57° E of City Of Bogo (Cebu),008,S 57° E,City Of Bogo (Cebu)
2025-11-14T01:11:00.000Z,14 November 2025 - 01:11 AM,07.86,126.00,007,2.4,007km N 60° W of Monkayo (Davao De Oro),007,N 60° W,Monkayo (Davao De Oro)
2025-11-14T00:39:00.000Z,14 November 2025 - 12:39 AM,11.30,124.58,004,2.7,007km N 80° W of Capoocan (Leyte),007,N 80° W,Capoocan (Leyte)
2025-11-14T00:34:00.000Z,14 November 2025 - 12:34 AM,07.03,126.92,033,1.5,046km S 65° E of Manay (Davao Oriental),046,S 65° E,Manay (Davao Oriental)
2025-11-14T00:27:00.000Z,14 November 2025 - 12:27 AM,07.55,124.64,002,1.9,014km S 45° W of Wao (Lanao Del Sur),014,S 45° W,Wao (Lanao Del Sur)
2025-11-14T00:09:00.000Z,14 November 2025 - 12:09 AM,15.60,120.02,027,1.4,010km S 74° E of Candelaria (Zambales),010,S 74° E,Candelaria (Zambales)
