datetime_iso,datetime_ph,latitude_(n),longitude_(e),depth_km,mag,location,distance_km,bearing,reference_location
2026-01-24T00:10:00.000Z,24 January 2026 - 12:10 AM,18.98,121.35,015,2.6,014km N 10° W of Fuga Island (Aparri) (Cagayan),014,N 10° W,Fuga Island (Aparri) (Cagayan)
2026-01-24T00:01:00.000Z,24 January 2026 - 12:01 AM,08.03,126.49,024,1.5,009km S 86° E of Lingig (Surigao Del Sur),009,S 86° E,Lingig (Surigao Del Sur)
2026-01-23T23:48:00.000Z,23 January 2026 - 11:48 PM,06.36,123.79,033,1.7,036km S 53° W of Kalamansig (Sultan Kudarat),036,S 53° W,Kalamansig (Sultan Kudarat)
2026-01-23T23:17:00.000Z,23 January 2026 - 11:17 PM,07.91,124.64,016,1.7,014km N 20° W of Amai Manabilang (Lanao Del Sur),014,N 20° W,Amai Manabilang (Lanao Del Sur)
2026-01-23T23:14:00.000Z,23 January 2026 - 11:14 PM,06.61,123.72,016,2.1,037km N 80° W of Kalamansig (Sultan Kudarat),037,N 80° W,Kalamansig (Sultan Kudarat)
2026-01-23T23:12:00.000Z,23 January 2026 - 11:12 PM,07.80,124.55,008,3.1,015km N 83° W of Amai Manabilang (Lanao Del Sur),015,N 83° W,Amai Manabilang (Lanao Del Sur)
