datetime_iso,datetime_ph,latitude_(n),longitude_(e),depth_km,mag,location,distance_km,bearing,reference_location
2026-06-14T07:47:00.000Z,14 June 2026 - 07:47 AM,19.06,121.17,024,2.7,006km S 37° W of Dalupiri Island (Calayan) (Cagayan),006,S 37° W,Dalupiri Island (Calayan) (Cagayan)
2026-06-14T07:44:00.000Z,14 June 2026 - 07:44 AM,06.57,126.46,028,2.2,043km S 78° E of Governor Generoso (Davao Oriental),043,S 78° E,Governor Generoso (Davao Oriental)
2026-06-14T07:28:00.000Z,14 June 2026 - 07:28 AM,04.81,125.53,010,5.2,068km S 10° E of Balut Island (Municipality Of Sarangani) (Davao Occidental),068,S 10° E,Balut Island (Municipality Of Sarangani) (Davao Occidental)
2026-06-14T07:05:00.000Z,14 June 2026 - 07:05 AM,06.39,126.03,086,2.5,030km S 09° W of Governor Generoso (Davao Oriental),030,S 09° W,Governor Generoso (Davao Oriental)
2026-06-14T06:58:00.000Z,14 June 2026 - 06:58 AM,05.17,124.70,015,3.1,083km S 23° W of Maasim (Sarangani),083,S 23° W,Maasim (Sarangani)
2026-06-14T06:52:00.000Z,14 June 2026 - 06:52 AM,05.40,125.61,013,2.5,017km S 62° E of Sarangani Island (Municipality Of Sarangani) (Davao Occidental),017,S 62° E,Sarangani Island (Municipality Of Sarangani) (Davao Occidental)
