datetime_iso,datetime_ph,latitude_(n),longitude_(e),depth_km,mag,location,distance_km,bearing,reference_location
2026-01-24T09:21:00.000Z,24 January 2026 - 09:21 AM,06.44,123.67,004,2.8,044km S 73° W of Kalamansig (Sultan Kudarat),044,S 73° W,Kalamansig (Sultan Kudarat)
2026-01-24T08:52:00.000Z,24 January 2026 - 08:52 AM,04.96,126.45,057,4.0,122km S 62° E of Sarangani Island (Municipality Of Sarangani) (Davao Occidental),122,S 62° E,Sarangani Island (Municipality Of Sarangani) (Davao Occidental)
2026-01-24T08:38:00.000Z,24 January 2026 - 08:38 AM,08.91,126.49,033,1.5,021km S 89° E of Cagwait (Surigao Del Sur),021,S 89° E,Cagwait (Surigao Del Sur)
2026-01-24T08:28:00.000Z,24 January 2026 - 08:28 AM,07.90,126.56,002,1.7,017km N 45° E of Cateel (Davao Oriental),017,N 45° E,Cateel (Davao Oriental)
2026-01-24T08:25:00.000Z,24 January 2026 - 08:25 AM,08.86,126.41,034,4.0,014km N 61° E of Marihatag (Surigao Del Sur),014,N 61° E,Marihatag (Surigao Del Sur)
2026-01-24T08:23:00.000Z,24 January 2026 - 08:23 AM,10.09,126.02,022,3.4,008km N 13° W of Santa Monica (Surigao Del Norte),008,N 13° W,Santa Monica (Surigao Del Norte)
