datetime_iso,datetime_ph,latitude_(n),longitude_(e),depth_km,mag,location,distance_km,bearing,reference_location
2026-04-07T02:47:00.000Z,07 April 2026 - 02:47 AM,12.55,124.89,018,2.4,002km N 38° E of San Roque (Northern Samar),002,N 38° E,San Roque (Northern Samar)
2026-04-07T02:20:00.000Z,07 April 2026 - 02:20 AM,09.02,125.58,038,1.6,004km S 08° W of Remedios T. Romualdez (Agusan Del Norte),004,S 08° W,Remedios T. Romualdez (Agusan Del Norte)
2026-04-07T02:16:00.000Z,07 April 2026 - 02:16 AM,06.51,125.96,001,1.5,020km S 39° W of Governor Generoso (Davao Oriental),020,S 39° W,Governor Generoso (Davao Oriental)
2026-04-07T02:16:00.000Z,07 April 2026 - 02:16 AM,10.94,124.02,009,2.6,012km S 20° E of City Of Bogo (Cebu),012,S 20° E,City Of Bogo (Cebu)
2026-04-07T02:14:00.000Z,07 April 2026 - 02:14 AM,08.44,127.32,033,2.2,109km N 86° E of Hinatuan (Surigao Del Sur),109,N 86° E,Hinatuan (Surigao Del Sur)
2026-04-07T01:59:00.000Z,07 April 2026 - 01:59 AM,10.07,122.48,003,1.7,019km N 55° W of Cauayan (Negros Occidental),019,N 55° W,Cauayan (Negros Occidental)
