datetime_iso,datetime_ph,latitude_(n),longitude_(e),depth_km,mag,location,distance_km,bearing,reference_location
2025-11-15T17:18:00.000Z,15 November 2025 - 05:18 PM,09.00,126.40,027,2.3,014km N 53° E of Cagwait (Surigao Del Sur),014,N 53° E,Cagwait (Surigao Del Sur)
2025-11-15T17:10:00.000Z,15 November 2025 - 05:10 PM,08.07,126.38,031,1.7,005km N 41° W of Lingig (Surigao Del Sur),005,N 41° W,Lingig (Surigao Del Sur)
2025-11-15T16:49:00.000Z,15 November 2025 - 04:49 PM,07.22,126.89,004,3.0,039km N 89° E of Manay (Davao Oriental),039,N 89° E,Manay (Davao Oriental)
2025-11-15T16:41:00.000Z,15 November 2025 - 04:41 PM,11.14,123.94,011,2.4,011km N 22° W of City Of Bogo (Cebu),011,N 22° W,City Of Bogo (Cebu)
2025-11-15T16:32:00.000Z,15 November 2025 - 04:32 PM,11.06,124.03,003,1.4,006km N 69° E of City Of Bogo (Cebu),006,N 69° E,City Of Bogo (Cebu)
2025-11-15T16:26:00.000Z,15 November 2025 - 04:26 PM,10.97,123.93,006,2.5,010km S 32° W of City Of Bogo (Cebu),010,S 32° W,City Of Bogo (Cebu)
