datetime_iso,datetime_ph,latitude_(n),longitude_(e),depth_km,mag,location,distance_km,bearing,reference_location
2025-10-22T04:09:00.000Z,22 October 2025 - 04:09 AM,05.97,126.08,134,2.1,048km N 83° E of Jose Abad Santos (Davao Occidental),048,N 83° E,Jose Abad Santos (Davao Occidental)
2025-10-22T03:57:00.000Z,22 October 2025 - 03:57 AM,07.58,122.14,011,2.7,001km S 16° W of Sirawai (Zamboanga Del Norte),001,S 16° W,Sirawai (Zamboanga Del Norte)
2025-10-22T03:57:00.000Z,22 October 2025 - 03:57 AM,17.66,120.40,003,2.9,003km N 33° W of Santo Domingo (Ilocos Sur),003,N 33° W,Santo Domingo (Ilocos Sur)
2025-10-22T03:54:00.000Z,22 October 2025 - 03:54 AM,05.72,126.46,061,3.2,093km S 77° E of Jose Abad Santos (Davao Occidental),093,S 77° E,Jose Abad Santos (Davao Occidental)
2025-10-22T03:53:00.000Z,22 October 2025 - 03:53 AM,10.97,124.03,028,2.0,010km S 33° E of City Of Bogo (Cebu),010,S 33° E,City Of Bogo (Cebu)
2025-10-22T03:43:00.000Z,22 October 2025 - 03:43 AM,09.76,126.18,032,2.5,003km S 37° E of General Luna (Surigao Del Norte),003,S 37° E,General Luna (Surigao Del Norte)
2025-10-22T03:20:00.000Z,22 October 2025 - 03:20 AM,07.23,126.76,022,1.8,024km N 85° E of Manay (Davao Oriental),024,N 85° E,Manay (Davao Oriental)
2025-10-22T03:18:00.000Z,22 October 2025 - 03:18 AM,07.25,126.87,025,2.5,036km N 84° E of Manay (Davao Oriental),036,N 84° E,Manay (Davao Oriental)
2025-10-22T03:16:00.000Z,22 October 2025 - 03:16 AM,09.47,126.25,030,2.1,036km S 17° E of General Luna (Surigao Del Norte),036,S 17° E,General Luna (Surigao Del Norte)
